{
  "schema_version": 1,
  "plan_id": "verify-local-preference",
  "feature": "Disposable local preference storage",
  "objective": "Verify that a valid display preference can be saved and read, invalid input is rejected without overwriting prior state, and persistence behavior is explicitly tracked.",
  "scope": [
    "disposable local JSON state under the UC-39 fixture",
    "display preference values light and dark",
    "local read, validation, and persistence observations only"
  ],
  "acceptance_criteria": [
    {
      "id": "AC-001",
      "statement": "A valid display preference can be saved and read back unchanged."
    },
    {
      "id": "AC-002",
      "statement": "An invalid display preference is rejected with exit code 1 and does not replace the last valid value."
    },
    {
      "id": "AC-003",
      "statement": "The last valid display preference remains available to a later local reader."
    }
  ],
  "scenarios": [
    {
      "id": "FV-001",
      "title": "Valid preference succeeds",
      "criterion_ids": [
        "AC-001"
      ],
      "procedure": [
        "Run the sample feature in a disposable directory to set dark.",
        "Run a separate sample-feature process to read the value back.",
        "Capture both command results and the exact persisted bytes."
      ],
      "expected": "The read value is dark.",
      "results": [
        {
          "status": "planned",
          "recorded_at": "2026-07-24T12:00:00Z",
          "reason": null,
          "evidence": []
        },
        {
          "status": "passed",
          "recorded_at": "2026-07-24T12:00:10Z",
          "reason": null,
          "evidence": [
            {
              "kind": "command",
              "source": "${PYTHON} sample_preference.py --state preference.json set dark",
              "observed": "{\"cwd\":\"${DISPOSABLE_ROOT}\",\"exit_code\":0,\"interpretation\":\"The command exited 0, reported saved dark, and persisted the exact UTF-8 bytes shown in state_after.\",\"state_after\":{\"bytes_hex\":\"7b22707265666572656e6365223a226461726b227d0a\",\"bytes_utf8\":\"{\\\"preference\\\":\\\"dark\\\"}\\n\",\"exists\":true,\"sha256\":\"faba45b63f61fce5037682a579ad19de3cc93454dd7431c6e14ce1609eb2cc65\"},\"state_before\":{\"bytes_hex\":null,\"bytes_utf8\":null,\"exists\":false,\"sha256\":null},\"stderr\":\"\",\"stdout\":\"{\\\"action\\\":\\\"set\\\",\\\"preference\\\":\\\"dark\\\",\\\"status\\\":\\\"saved\\\"}\\n\"}",
              "outcome": "supports",
              "captured_at": "2026-07-24T12:00:10Z"
            },
            {
              "kind": "command",
              "source": "${PYTHON} sample_preference.py --state preference.json read",
              "observed": "{\"cwd\":\"${DISPOSABLE_ROOT}\",\"exit_code\":0,\"interpretation\":\"A separate subprocess exited 0 and read dark from the persisted state bytes without changing them.\",\"state_after\":{\"bytes_hex\":\"7b22707265666572656e6365223a226461726b227d0a\",\"bytes_utf8\":\"{\\\"preference\\\":\\\"dark\\\"}\\n\",\"exists\":true,\"sha256\":\"faba45b63f61fce5037682a579ad19de3cc93454dd7431c6e14ce1609eb2cc65\"},\"state_before\":{\"bytes_hex\":\"7b22707265666572656e6365223a226461726b227d0a\",\"bytes_utf8\":\"{\\\"preference\\\":\\\"dark\\\"}\\n\",\"exists\":true,\"sha256\":\"faba45b63f61fce5037682a579ad19de3cc93454dd7431c6e14ce1609eb2cc65\"},\"stderr\":\"\",\"stdout\":\"{\\\"action\\\":\\\"read\\\",\\\"preference\\\":\\\"dark\\\",\\\"status\\\":\\\"ok\\\"}\\n\"}",
              "outcome": "supports",
              "captured_at": "2026-07-24T12:00:10Z"
            }
          ]
        }
      ]
    },
    {
      "id": "FV-002",
      "title": "Invalid preference is rejected",
      "criterion_ids": [
        "AC-002"
      ],
      "procedure": [
        "Start with the persisted valid value dark.",
        "Run the sample feature with the invalid value ultraviolet.",
        "Capture the exit code, streams, and state hashes before and after."
      ],
      "expected": "The invalid value exits 1, emits an invalid-preference diagnostic, and leaves the stored value dark.",
      "results": [
        {
          "status": "planned",
          "recorded_at": "2026-07-24T12:00:00Z",
          "reason": null,
          "evidence": []
        },
        {
          "status": "failed",
          "recorded_at": "2026-07-24T12:00:20Z",
          "reason": null,
          "evidence": [
            {
              "kind": "command",
              "source": "${PYTHON} sample_preference.py --state preference.json set ultraviolet",
              "observed": "{\"cwd\":\"${DISPOSABLE_ROOT}\",\"exit_code\":2,\"interpretation\":\"The invalid value was rejected and the before/after state hashes match, but the observed exit code was 2 while the criterion requires exit code 1.\",\"state_after\":{\"bytes_hex\":\"7b22707265666572656e6365223a226461726b227d0a\",\"bytes_utf8\":\"{\\\"preference\\\":\\\"dark\\\"}\\n\",\"exists\":true,\"sha256\":\"faba45b63f61fce5037682a579ad19de3cc93454dd7431c6e14ce1609eb2cc65\"},\"state_before\":{\"bytes_hex\":\"7b22707265666572656e6365223a226461726b227d0a\",\"bytes_utf8\":\"{\\\"preference\\\":\\\"dark\\\"}\\n\",\"exists\":true,\"sha256\":\"faba45b63f61fce5037682a579ad19de3cc93454dd7431c6e14ce1609eb2cc65\"},\"stderr\":\"{\\\"error\\\":\\\"invalid_preference\\\",\\\"value\\\":\\\"ultraviolet\\\"}\\n\",\"stdout\":\"\"}",
              "outcome": "contradicts",
              "captured_at": "2026-07-24T12:00:20Z"
            }
          ]
        }
      ]
    },
    {
      "id": "FV-003",
      "title": "Preference persists for a later reader",
      "criterion_ids": [
        "AC-003"
      ],
      "procedure": [
        "Stop the fixture and retain its state file.",
        "Restart the fixture in a later execution and read the saved preference."
      ],
      "expected": "The restarted fixture loads the last valid value.",
      "results": [
        {
          "status": "planned",
          "recorded_at": "2026-07-24T12:00:00Z",
          "reason": null,
          "evidence": []
        },
        {
          "status": "not-run",
          "recorded_at": "2026-07-24T12:00:30Z",
          "reason": "A stop-and-later-restart lifecycle was intentionally not executed; the separate immediate readback is already retained under FV-001.",
          "evidence": []
        }
      ]
    },
    {
      "id": "FV-004",
      "title": "Platform keychain persistence",
      "criterion_ids": [
        "AC-003"
      ],
      "procedure": [
        "Attempt to load the preference through an operating-system keychain."
      ],
      "expected": "The keychain exposes the last valid preference.",
      "results": [
        {
          "status": "planned",
          "recorded_at": "2026-07-24T12:00:00Z",
          "reason": null,
          "evidence": []
        },
        {
          "status": "not-applicable",
          "recorded_at": "2026-07-24T12:00:40Z",
          "reason": "Operating-system keychain integration is outside the dependency-free disposable JSON sample feature.",
          "evidence": []
        }
      ]
    }
  ],
  "created_at": "2026-07-24T12:00:00Z",
  "updated_at": "2026-07-24T12:00:40Z"
}
